1399503519,"And good evening. Iêm David Gregory. Welcome to the Maryland Gubernatorial Debate among the Democratic candidates, Lieutenant Government Anthony Brown, Delegate Heather Mizeur and Attorney General Doug Gansler by the University of Maryland, NBC-4 and Bowie State University."1399503537,"This debate is also airing on WAG in Hagerstown, Maryland, Public-- Maryland Public Television and streaming live on NBCWashington.com. I wanna begin by quickly going over the rules of tonightês debate, their rules, the candidatesê debate. The debate will last one hour. Weêll begin with one-minute long opening statements from each candidate. The order has already been determined during a random drawing."1399503560,"Then our panelists and I will pose questions directly to the candidate, these are questions determined by NBC News and-- and NBC-4. The panelists have not reviewed-- the questions, not has the University of Maryland. I am also in the role of time-- the role of time keeper here, Iêve got so many accouterments to help me measure the time, so Iêll be keeping everybody to time."1399503582,"Each candidate is going to have one minute to respond. As moderator, Iêll also be allowed to follow up with questions or-- provide a 30-second rebuttal to the candidates as necessary. Finally, the debate will conclude with closing statements. A time keeper will be located in the front row of the audience, facing the candidates. The time keeper will notify candidates of their remaining time and when time has expired."1399503607,"In the interest of trying to cover as much ground as possible, we ask the candidates to adhere to these time limits; politicians always keep to time, come on. (LAUGH) And-- we also as that the-- the audience listen quietly--no applause, please, over the course of this-- no shouting during the debate."1399503624,"Now I wanna welcome our panelists tonight. Chris Lawrence, whoês a News 4 anchor. Heês spent the last decade covering some of the biggest national stories for CNN before joining the NBC family. Chris is an alumnus of the University of Maryland here at College Park, so a welcome home for him. Chris, welcome."1399503641,Thank you.1399503643,"Jenna Johnson writes about Maryland politics, including the General Assembly, and the 2014 election for The Washington Post. She has been with The Post since 2007. Finally, Chris Gordon, a lawyer; he has been a reporter in this area for almost three decades and for more than 15 years heês covered Maryland politics and legal issues across the state for NBC-4. And now, please welcome the Democratic candidates for governor."1399503668,"The Attorney General of Maryland, Doug Gansler. Maryland State Delegate, Heather Mizeur and Lieutenant Governor, Anthony Brown. Attorney General Gansler, you will be first with your one-min-- one-minute, I should say, opening statement. (MIC NOISE) So the floor is yours."1399503685,"Thank you, David. Thank you the University of Maryland, Bowie State and NBC for hosting us to date this evening. As your governor, I will continue to do what I have done for the past 22 years in public service, and thatês when I see something thatês unfair or wrong, I will fight relentlessly to solve the problem and get things done. Whether itês bringing the Beltway Snipers to justice, arguing in front of the Supreme Court of the United States to keep a child molester behind bars, suing big oil to clean up its spills or preventing big tobacco for marketing-- cigarettes to our children."1399503718,"As your governor, I will give voice to the voiceless, making sure that every Marylander has access to healthcare; creating and strengthening the middle class by creating jobs; taking on the pollution lobbyists so we have clean air and a clean bay, and making sure that in every classroom, we have skilled teachers for every student everywhere in Maryland. You see, I grew up in this state and thereês so much good about this state, but from jobs to healthcare to the environment, we can do so much more. And thatês my (UNINTEL)."1399503755,"And next up, thank you, now up, Delegate Mizeur, your one-minute opening statement."1399503758,"Thank you, David. When I was nine years old, the factory where my father was a union welder went on strike for fair wages. And over the next six months, my family and I struggled to live on $45 a week strike pay. During that period of time, my father took me with him to the picket lines, where I got to see first-hand men and women standing up for what they believe in with incredible courage."1399503783,"I have remembered this my entire time in Annapolis, standing up for Maryland families. Iêve expanded health insurance to 50,000 more children in our state, passed bipartisan legislation to give thousands of low-income women access to free family planning services. And just last month, decriminalized the possession of marijuana. But for all of our successes, there are still too many families who are falling behind in our state. As your governor, I will create jobs with a living wage, reduce that income inequality gap, invest in our schools and drive down violence in our neighbors with a Smart on Crime strategy. Together, we will deliver real results for Maryland families."1399503825,"All right, thank you, Lieutenant Governor, please."1399503829,"Thank you, David, and panelists, sponsors and audience. Good evening. Iêm a generation removed from poverty. My father was raised by his grandmother, my great-grandmother-- in a one-bedroom home on a dirt floor in Kingston, Jamaica, a poor neighborhood called Jonestown."1399503846,"And when my father was a little bit older than my son Jonathan is today, he wrote a letter to his mother, my grandmother, already in this country, he said, –Mom, bring me to America, I wanna be a doctor, I wanna heal people.” She wasnêt a wealthy woman; a woman without an education, but knew the importance of an education. So she saved her money, brought me father, her son to this country, he was the first in our family to get a college education."1399503870,"My father spent a lifetime as a family doctor, treating people and serving people, even those who couldnêt pay for his services. When I grew up, I knew I wanted to be just like my father. I didnêt go to medical school, but I had the privilege to serve our country in the Army, then in the House of Delegates, and for the last eight years as your Lieutenant Governor. Together, we will build a better Maryland for more Marylanders and I look forward to doing that with each and every one of you."1399503896,"All right, thank you all very much. Letês talk about the issues, Iêm gonna start. Healthcare is something that-- Americans are concerned about across the board, especially with the Affordable Care Act. Iêm gonna ask-- this question to three of you in the order that it was designed, so Iêll start with you, Attorney General Gansler-- it is widely-- argued by you and others and believe that the roll out of the healthcare Exchange here was a disaster. Who ultimately is accountable for that? What is the impact of it and how would you fix it?"1399503923,"Well, thank you, David. The-- Lieutenant Governor for a number of years has touted that he is in charge of the Affordable Care Act roll out; and in fact, right now, if you look on his website, it says that Maryland has led the country in the Affordable Care Act roll out."1399503936,"The Washington Post, The Baltimore Sun, Senator Mikulski and many others have called it a national disaster. I think the Lieutenant Governor is the only person that believes itês been a success. Weêre actually 45th in the country in terms of people enrolled, so thatês relatively delusional. We (UNINTEL) $200 million of taxpayer money and (UNINTEL) on the web-- on the website was broken and flushed it down the toilet."1399503958,"And the tragedy is that real people canêt get diabetes screening, healthcare for their children, heart disease medication. And of course-- for somebody to-- to co-chair President Obamaês campaign here in Maryland and-- and went to the United States Supreme Court and had Maryland as the lead plaintiff in the Affordable Care Act Constitutionality, it gives the Republicans a chance to attack our President for doing something no other President was able to do, which is-- make the United States like every other industrial country in the world--"1399503985,"All right, Attorney-- Attorney General--"1399503986,(UNINTEL) citizens.1399503987,youêre out of time. Whoês ultimately responsible? Whoês accountable for this?1399503991,"The-- Lieutenant Governor-- under his own-- under his own recognition. He said, –This is--” the problem is this is, literally, the one thing heês been in charge of, thatês heês managed or heês led since he was Lieutenant Governor and itês been an unmitigated disaster."1399504003,"All right, the Lieutenant Governor will have a moment to respond in full in just a moment when we come to you, but Delegate Mizeur, same question to you-- whoês ultimately accountable for this and what would you do to fix this?"1399504014,"David, Iêm not about casting blame, Iêm about fixing the problem and making sure that families get access to the healthcare that they deserve. I have spent a lifetime making sure that people have access to affordable, quality healthcare. I believe that healthcare is a right, no a privilege. I have been a strong supporter of the Affordable Care Act from the beginning, because as a delegate, I have been working in our state for years to get many of those same provisions passed in our state."1399504039,"The first piece of legislation that I passed was a bill that allowed young adults to remain on their familyês health plan until theyêre 25. Thatês now federal law because we showed how it worked in Maryland first. And I learned in passing bills to get 50,000 more children health insurance or getting women access to free family planning services that what matters most is that reforms are implemented effectively."1399504065,"Our ideas and our vision matter in this election, but our records of management matter even more. You want a governor with a successful track record of implementing health reforms, then I am that leader."1399504077,"Okay, Lieutenant Governor, are you ultimately accountable for this?"1399504080,"David, as Iêve said on numerous occasions, everyone involved with establish (PH) in the Health Benefit Exchange is responsible, and that includes me. Iêm not new to healthcare; for the last eight years, we have expanded healthcare to over 500,000 Marylanders who didnêt have access before."1399504097,"So when we set out to implement the Affordable Care Act just like the President, with the difficulties in the federal website and the difficulties they had on the launch, so too, did we in Maryland, and I sincerely regret that any Marylander was inconvenienced, trying to get-- healthcare through the broken website."1399504113,"But nobody was more frustrated than me, and thatês why I took the action that I did. I reorganized the leadership at The Exchange; the Executive Director left. We refocused the vendors, fired those who didnêt perform as promised, including IBM, and after evaluating the resources and capabilities at The Exchange, we plussed up (PH) the call centers and the navigators, and the result, David, 330,000 Marylanders now with access to accordable, quality health--"1399504141,"But lemme follow up on this, you heard the Attorney General say the amount of money that is going to chase after this mistake-- youêre about 50% behind where youêd like to be in getting people enrolled. On the national level, this was an issue in terms of getting those young, healthy people to pay attention, ultimately, and to sign up for something that they think is broken. How do ya deal with that?"1399504159,"Well, l-- letês give it the bench mark first, the bench mark is our goal in Maryland was 260,000, we enrolled 330,000. 260,000 in Medicaid-- now, Medicaidês important, you know-- for better or for worse, you like it or not, in America, Medicaid is the health insurance for the working poor, so weêve expanded health insurance to Marylandês poor and working families, 260,000, but a total of 330,000. So today, in order to ensure that we have a seamless transition for the Open Enrollment in November, weêre adopting proven technology in Connecticut."1399504190,Lemme give 30 seconds to the Attorney General in-- in a rebuttal to this.1399504193,"Well, thereês a couple of things. First of all, the-- the actual number that we know that was-- able to sign up through the website was through Jenna Johnsonês article and the last weêve heard was four people. And that is because thereês been a cover up from the special interests that donêt-- doesnêt want us to know what happens. So what they then did, they went into a closed room and they decided they were going to chase good money after bad and spend another $60 million to get the Connecticut Exchange to come down here and try to retro fit it."1399504218,"Even the Connecticut people say it wonêt work, but we certainly wonêt know if itêll work if we donêt find out what happens in the first place to the $200 million."1399504223,"All right, weêre gonna keep the conversation going with Chris Lawrence, moving onto another topic."1399504229,"Yeah, the-- the decriminalization of marijuana has a lotta people in Maryland wondering, –Whatês the next step?” And if that includes legalizing marijuana. Yet, the governor of one of the most progressive states in this country has recently raised some serious concerns about that issue. Californiaês Jerry Brown, says, quote, –If thereês advertising and legitimacy, how many people can get stoned and still have a great state or a great nation?” But my question to all of you is is the money that the state could get from taxing this drug worth accepting it in Maryland? And Iêd like to begin with Delegate Mizeur."1399504270,"Thank you for the question. Our marijuana prohibition laws have been a failure; they have been enforced with racial bias. African-Americans and whites in our state use marijuana with the exact same frequency, but African-Americans go to jail three times more often."1399504285,"Thatês why I fought for decriminalization in this session. Weêre not putting 23,000 people in jail anymore because of their nonviolent possession of this drug; weêre not spending $280 million a year on the incarceration, detention and court costs associated with this. But if we legalize, tax and regulate marijuana, not only are we bring in a new revenue source that I dedicate to paying for a universal pre-k program, but we would also be sending an importance message about the fact that this is a substance that is arguably less harmful to the body than alcohol and tobacco."1399504321,"And for adults, it should be treated the same way. For youth, we have to step in and make sure they donêt have access. And there are no campaigns to keep-- marijuana out of the hands of our youth. What drug dealer cards for an ID? I have a plan to spend $4 million a year to make sure that young people donêt have access--"1399504339,Lieutenant Governor.1399504339,"Thank you, David. Look, Heather and I agree on a number of issues-- and disagree on-- on probably a fewer number. I donêt agree with-- Delegate Mizeurês call for legalization at this time. I think there are two states that are looking at it. We outta be looking at not just the money, but the socio-economic effects. But I do agree with Del-- Delegate Mizeur in the decriminalization of possession of small amounts of marijuana."1399504364,"We spend over $100 million in this state prosecuting possession of small-- amounts, and that could go to (UNINTEL) and more violent crime. Also, as just pointed out, disproportionately, African-American-- particularly, African-American young men are arrested at higher rates, yet consumption rates are in the same in this country."1399504382,"But I fundamentally disagree with the values of the Attorney General when it comes to rooting out racist practices in the criminal justice system. I oppose the death penalty and I fought long and hard to repeal it in Maryland. The-- the Attorney General supports it, says itês a wonderful tool, he says itês reliable for conviction, but studies have shown itês not reliable. It (UNINTEL) and impacts--"1399504405,All right--1399504404,African-Americans and it doesnêt deter crime.1399504407,"Attorney General, take 30 seconds to respond to that particular point before you answer Chrisês question."1399504412,"Well-- itês curious that he says heês fought for years because every time that a repeal the death penalty bill came up while he was a delegate in Annapolis, other delegates signed up to sponsor the bill and-- the Lieutenant Governor was nowhere to be found until he was running for governor."1399504425,"The death penalty is a lot like prohibition; itês-- itês not-- itês a non-issue in this-- campaign, it-- the General Assembly has repealed it, the public has spoken on it. When I-- Iêve been a prosecutor for 22 years and I never sought the death penalty once."1399504437,"So letês talk about marijuana, then, and itês--"1399504440,"So as-- as-- as a former Assistant United States Attorney in the Clinton Administration-- Stateês Attorney, Montgomery Attorney, now Attorney General, I understand the-- the ravages that drugs do cause families and-- the addictions and what they do to people."1399504453,"I happen to agree that-- medical marijuana is-- is something we should allow-- to have, as long as itês being prescribed by real doctors. And decriminalization is-- is someplace we should have gone. I donêt think, though, and I agree with the Lieutenant Governor, that we should go to legalization right now."1399504469,"Former Attorney General-- Brown of California is-- is right. We have to make sure we allow some of these states, to see (UNINTEL) how it works. Marijuana hasnêt been legal-- for hundreds of years, letês see how it works. Thereês no rush-- iron out any of the problems, but we shouldnêt be motivated by taxes when we do it. We should make sure that we-- if we are gonna legalize marijuana, and hopefully, that wonêt happen for a long time, we do it in lock step with public safety officials and public health officials because-- we shouldnêt be motivated by having yet another tax-- on a product. Now I can say, the decriminalization is for such small amounts that very few people are locked up on that at all--"1399504503,"And Delegate Mizeur, just a final 30 seconds on this. With legalization in your views, are you comfortable saying to the children of this state, –Marijuanaês okay”?"1399504514,"Weêre not saying that to the children of this state. To the children of this state, weêre saying that itês a very dangerous substance for a developing mind, and weêre gonna spend $4 million a year to make sure that they understand that. But what drug dealer is carding for an ID right now? Thatês how kids are getting access."1399504529,"And when we legalize, tax and regulate it, the stateês in charge of this. And the same way we do with alcohol, we improve our chances of keeping it out of the hands of our youth. The Institute of Medicine actually said that the-- the gateway drug theory is about the drug-- about marijuana being prohibited, that the laws against it are what actually has young people having more access."1399504552,To Chris Gordon now.1399504554,"There is a perception that Maryland is not business friendly, you may have heard it. I have on the street. And-- there are four Republican candidates running for the same job you are who say that taxes have been raised and created dozens and dozens of times in the last seven years of this administration and theyêre gonna blame Democratic lawmakers. So my question to-- in fact, they wanna reduce or do away with some of those taxes. So would you lower or raise taxes and how do you attract business and new jobs to the state?"1399504588,Lieutenant?1399504590,Lieutenant Governor Brown.1399504590,"Look, Iêm traveled around the-- state-- and spoken with business leaders from all four corners, there is concern about the business climate in Maryland and I rolled out a proposal to position Maryland to be the most competitive business climate state in the nation. Part of itês looking at regulations and licensing, and part of it is looking at our tax liability. Look, in the first 100 days of the Brown-Ulman Campaign, we are going to put together a Blue Ribbon Commission to look at tax reform."1399504617,"Weêre gonna make sure that weêre giving a (UNINTEL) to working families, that weêre incentivizing employers to invest in job-creating activities in Maryland and that weêre protecting our investments in education, public safety, the environment and healthcare."1399504630,"But my tax plan will not include and it doesnêt, the corporate giveaway under the Gansler Corporate Tax giveaway. If weêre gonna invest in education, if weêre gonna invest in transportation, we canêt afford to give a small number of the largest corporations in Maryland a $1.6 billion tax giveaway. Itês under that plan that Doug has said we canêt fund pre-k education for all Maryland four-year-olds. Thatês not my thing--"1399504652,"Time. So the-- so the Attorney General, the-- the same question."1399504657,"Thank you, Chris. Itês not a perception; itês a reality. We have had 40 consecutive tax increases here in Maryland. The people of Maryland just canêt take it anymore. We got 76% more people unemployed than when Lieutenant Governor came to power-- when heês been at the seat of power-- and stood by when all this was happening to our state."1399504675,"In Baltimore City, 46% of the adult males donêt have work; weêve lost over 7,000 small businesses in the last eight years. Weêre 43rd in the country in manufacturing and we only have four Fortune 500 companies left here in Maryland. This is one of the richest states and one of the smartest states in the country in terms of advanced degrees. So we cannot continue to mortgage the economic viability of the future of this state on the backs of casino gambling and more tax increases. We need to bring life science companies here, cyber security companies here."1399504705,"We need to look at what New York has done in terms of manufacturing-- having tax-free incentives to manufacturing, so people can once again get back to work in the state of Maryland. Because we canêt continue to have half a billion and do billion-dollar deficits every year in Annapolis."1399504718,"Iêm the only one on this stage that has owned a small business and Iêm the only one with a plan to help them grow. I have a different vision about our economy, one that doesnêt pit workers against businesses. My job creation strategy includes something for us all. If we were to bring back the Millionairesê Tax and close one corporate tax loophole that allows a handful of companies in our state that operate in other states, who are avoiding paying their fair share of Maryland taxes-- just ask them to pay their fair share."1399504748,"We could generate enough revenue to give 90% of all Maryland families a tax cut and tax relief for all of our small businesses. If we put more money in the hands of middle class families, what do they do? They spend it in the economy; they go out to eat at more restaurants; they buy more shoes for their children and school supplies. And I have a plan to put people to work, rebuilding our roads, our transit and building 21st century schools."1399504775,"All right. Violent crime is down across the state, except for one category, forcible rape. In 2012, more than 1200 people reported being raped in Maryland, and advocates say even more cases go unreported. The Obama Administration has launched several initiatives aimed at reducing and combating sexual violence in the military and on college campuses. What will you do here in Maryland to address sexual violence? And Attorney General, weêll start with you."1399504810,"Thank you. Weêre actually-- the ninth most violent state in the country, Baltimore Cityês the seventh most violent city in the country and we have the fourth most homicides in the country here in Maryland, so we have a lot of work to do. In terms of rape-- let me talk about Hollis Church (PH) for a moment."1399504826,"She was raped while watching television in Kensington one night; 13 years later-- I was able to personally go into court and prosecute the offender because-- we had a DNA hit from Virginia. We then went to the Supreme Court of the United States when I was Attorney General and made sure we upheld the DNA statues, and law enforcement could use DNA to solve on-- cold case rape cases."1399504847,"So we do have an issue here in Maryland, and we need to do a lot more in terms of our crime prevention and-- and going forward. We have-- community prosecution-- we need-- to make sure that we-- a lot of the rapes actually happened in domestic violence situations, and I started the first domestic violence court in-- in Montgomery County and we wanna have domestic violence courts all over the state when Iêm governor."1399504870,Delegate Mizeur.1399504872,"Any woman who is faced rape or domestic violence deserves to know that she has a governor and the law on her side. I have been pushing to erase the backlog of rape kits that are sitting in our criminal justice system. I have a plan to make sure that we remove guns from the scenes of domestic violence disputes, because we know that women are five times more likely to be hurt, harmed, killed, even, when their abuser has a firearm in the home."