1399506421,"And weêll also provide childcare subsidies, not just for low-income families, who have a long waiting list to get access to care, but for middle class families, as well, because our children need access to a quality, affordable, nurturing educational environment before they get into pre-k."1399506435,Lieutenant Governor.1399506437,"Thank you, Chris. We live in a much more just society today than we did eight years ago. Passed marriage equality, and-- and the Dream Act. We passed some of the most stringent gun safety measures in the wake of Newtown, Connecticut and we repealed the death penalty. I believe that the greatest challenge that we face as a state and as a nation, is to address the persistent, debilitating gaps, disparities and inequities that exist in our economy, in our society, in our community and yes, in our classrooms."1399506472,"And thatês why Iêve got a plan to create more jobs in Maryland, but not only create more jobs by investments and infrastructure and renewable energy, but to educate and train all of Marylandês workforce so they can compete s-- successfully for that. At the end of my four-year term, I hope that we can look back in Maryland and say, –We have career technology education in every high school or every county,” so that weêre not only preparing students--"1399506497,Time.1399506499,"who want to go to college, but those who donêt so that they are ready to enter the workplace and support their"1399506504,Final-- final question here from Chris.1399506507,"I wanna talk a little bit about something that you all have brought up. Governor OêMalley has signed off on about 40 new taxes since he took office, and yet, the number of Maryland families who need government help to make ends meet has reached record levels. And this is a very simple question: Would you raise taxes to cover the cost of continuing this level of government assistance? And I believe we go to the Lieutenant Governor first."1399506536,"Thank you. So I think the good news is, I-- I donêt see the need in the foreseeable future to have to raise taxes in Maryland. Weêve got the resources and the revenues to take on the tough challenges ahead, to fully fund education, to continue to drive down crime in neighborhoods throughout the state. I do believe that we ought to engage, as I said earlier, in comprehensive tax reform."1399506560,"Look, Maryland and America still has a level of poverty that is higher than it was when Doctor King when was waging the war against poverty in the 1960s with Lyndon Johnson, President Johnson. Thatês why weêve invested in Medicaid; thatês why weêve taken on a strategic goal to end childhood hunger; thatês why weêve expanded affordable housing."1399506581,"And Iêve got a plan to deliver even more affordable housing. Yeah, there are more demands, but Marylandês a great state and Maryland can be better for more Marylanders, if we apply our resources, effectively wisely in a socially prudent and fiscally responsible way."1399506595,Attorney General?1399506597,(UNINTEL) 40 straight taxes; people canêt take it anymore. Thereês been a recent poll by Gallup that says 40% of Marylanders want to leave this state because of the tax burden and the economic hardship that we face. We need to actually bring jobs back.1399506611,"We need to focus on the fact that we are the only state in the country that has NIH and Johnês Hopkins, number one hospital in-- in the country, as well as the University of Maryland Medical System. We need to focus on the fact that we have a Citer (PH) Command Center and the NSA here and we have the smartest people in the country in terms of the advanced degrees, yet, we donêt leverage that. And we need to bring manufacturing back to Maryland and we need to br-- make sure that Prince Georgeês Countyês economic development-- around its (UNINTEL) and development, because if we donêt have jobs, weêre gonna continue to have poor people."1399506639,"Thereês nowhere to go. And so, one of the things that we want to do is when youêre 16 years old, thereês some people that-- wanna get a job, that donêt wanna stay in school till theyêre 18 and go the traditional path. So theyêll have-- an ability to do a career and vocational and career apprenticeship where they can go-- in the afternoons and start-- and get certified (UNINTEL) to get a job."1399506657,Time. Delegate Mizeur.1399506661,"Being governor is about setting priorities and building budgets around it. Itês about revenues in and expenditures out. By decriminalizing marijuana, weêve created another $280 million in savings in our budget. By legalizing and taxing it, we create another $160 million. When we close the corporate tax loophole, the-- the handful of companies that are abusing right now, $200 million extra in our state."1399506685,"Bring back the Millionairesê Tax, another $112 million, and what do you get for that? A universal pre-k program, tax cuts for small businesses and 90% of all Maryland families get middle class tax relief they have been begging for in this state. These are my priorities and this is exactly how I will pay for them as your governor."1399506704,"All right. The closing statements. Delegate Mizeur, youêre gonna begin. You each have a minute. Please stick to time, weêre tight on it. Go ahead."1399506712,"I see it in living rooms and community centers all across this state. Voters want candidates who remain positive, who are focused on the policy and not platitudes, who remember that weêre always going to be stronger when we put our common good ahead of the priorities of special interests and-- and people who have extra access in Annapolis."1399506737,"Iêm a governor that wants to make sure Maryland works for all of our-- citizens. I will invest in infrastructure needs for our state, make sure that our schools are great in every corner, reduce crime in our neighborhoods and turn our minimum wage into a living wage."1399506754,"And for the women watching tonight, I know that for too long, the inequalities in our schools, in our pay and in our economy have existed for too long. It doesnêt have to be this way. I know what it takes to make Maryland work and be fair--"1399506773,All right.1399506773,[nothing]1399506776,"All right, Lieutenant Governor, please."1399506778,"Thank you, David. Over the last eight years, we-- and I say –we” collectively, have made tremendous progress as a state. We have built the best in the nation, public schools, but we know that not every childês educated in a Blue Ribbon school today."1399506792,"So our work continues. Weêve not only driven the crime down to the lowest levels weêve seen in three decades, but weêve reduced recidivism and our inmate population is smaller today than it was six years ago. Weêre one of only a handful of states that weathered the great recession with a AAA bond rating, we recovered jobs at a rate faster than every state in the mid-Atlantic, with an unemployment rate one full percent below the national average. But we know that there continue to be Marylanders who are unemployed and underemployed. Thatês why Iêve gotta plan. And I ask ya to go to AnthonyBrown.com, because in this hour, we didnêt discuss all of it."1399506827,"Iêve got a five-point plan to create jobs, Iêve got a plan to deliver universal pre-k to every Maryland four-year-old, greater investments in career technology education and school construction, but I need you. I need you to help me and Ken Ulman build a better Maryland for more Marylanders."1399506842,"The Attorney General, closing (UNINTEL)."1399506844,"Youêve heard a lot of back and forth this evening, and I wanna end by sharing what motivates me. Because during a political campaign, that does and can get distorted. Like you, my family motivates and defines me. Laura and I have been married for 22 years, weêre profoundly proud of our children, weêre incredibly devoted and involved parents, and we-- I want them to be proud of our public service. And-- and many families out there, you also motivate me, all the families I see around the state of Maryland."1399506874,"Because we have taken on judges-- because of that. We are-- I have mentored inner city kids when the system was left behind. Iêve taken on polluters-- cyber bullying, Internet fraud and Internet crime. And when Iêm governor, we will-- we will deliver the promise of healthcare reform, because healthcare is a right."1399506894,"So I just wanna leave you with one thought, if-- if thereês one thought you can be left with, which is this: I will always stand up against the special interests, because your fight is my fight."1399506904,"And we will leave it there. Thank you all very much. Thank you to our partners, University of Maryland, NBC-4, Bowie State University (APPLAUSE). (MUSIC)"