1399504901,"And Iêve been pushing for a paid sick leave that includes time off for safe time, for women who need to interact with the criminal justice system, work to get a restraining order or meet with an attorney to get the protection that she needs."1399504913,"We have to make sure that we protect and empower women, that we bring their abusers to justice and that we do everything we can to make sure that this violence isnêt repeated again. Iêll be the governor that helps get this done."1399504926,Lieutenant Governor?1399504929,"Now weêll build stronger communities and a foundation of stronger families when our wives, our mothers, our sisters and our daughters can live free of the fear of sexual assault, rape and domestic violence in the home, in the neighborhood and in the workplace. No familyês immune from that type of violence. My cousin, Kathy, was killed at the hands of her estranged boyfriend."1399504951,"And since that time, and even before, Iêve worked with the advocates of domestic violence. Weêve increased the number of domestic violence referral programs and sexual assault (UNINTEL) at our community hospitals from four to nine, and my goal is to reach every one of the 43 community hospitals in the state of Maryland."1399504970,"Together, weêve done a lot of work to reduce domestic violence against women, to make this a safer state for w-- for women. Weêve-- given judges the authority to order domestic abusers to surrender their firearms. This year, finally, after 19 years of failed effort, we lowered the standard and a woman can now get a protective order on a preponderance of the evidence standard, instead of the heightened clear and convincing standard."1399504991,All right.1399504993,"So weêre making a lot of progress, we have a lot more work to do."1399504995,Back to Chris Gordon.1399504996,"All right, this question-- deals with character, leadership and fitness for office. Youêve all had public service; we thank you for that. And Iêm gonna ask you each an individual question to answer here. Attorney General Gansler, your judgment has been questioned. With the pictures that we have seen from the party you attended-- your son was at, what may have been underage drinking and you said you did nothing to stop it, it was not in Maryland, it was in Delaware. But with your-- statements-- military service, you implied, was not-- a real job."1399505030,"And with your use of the state car, a report being that you asked your state (UNINTEL) to go through red lights or-- up-- the shoulder of a road to get to-- to an appointment on time. Lieutenant Governor Brown, we have heard tonight that you botched the roll out, and in fact, the Attorney General used the word –cover up” tonight."1399505048,"And-- Delegate Mizeur-- critics say that youêre just not experienced enough because youêve been a state delegate since 2007, but youêve never had state-wide elected office or experience as an executive. How do you all answer these critics? Delegate Mizeur, we start with you."1399505068,"Marylanders want a governor who knows how to bring people together to get big things done. Lemme tell ya two stories about the way Iêve done this, on family planning and marijuana decriminalization. I reached across the aisle to work with the head of the Tea Party Caucus to expand family planning services to low-income women, by first convincing him that it lowered the abortion rate and saved the state money."1399505088,"It also happens to be good for maternal and child health outcomes. Together we put partisanship on the shelf in order to make progress for our state. 34,000 more women have access to free family planning services in our state because of this."1399505102,"This year in the legislative session, which is 48 hours to go, the press all reported that our marijuana decriminalization effort was dead, it had got vote-- voted out of a committee and turned into a study (PH) bill. I worked with the legislative Black Caucus and a group of progressive legislators to come up with a strategy on the floor to turn that around. We passed that law, sent it to the Governorês desk, Maryland is now the 18th state to decriminalize marijuana. Both of these happened because of leadership."1399505130,Time.1399505130,Iêm the governor that this state is ready for.1399505132,"Lieutenant-- Lieutenant Governor, what about the-- the criticism? Your--"1399505135,Sure--1399505136,leadership-- the-- the fitness question.1399505139,"Sure, as governor, I would bring not only eight years of experience as Lieutenant Governor, but eight years in the General Assembly and 30 years in uniform and service to our country. As Lieutenant Governor-- during the last eight years, I led the effort on (UNINTEL) closure-- that is all ready today created or brought to our state 49,000 jobs and we are well on our way to meeting the goal of 60,000 jobs by 2022."1399505166,"Reduce violence against women and children and the work weêre doing on domestic violence, that Iêve had the opportunity to lead and work with so many on. Weêve reduced a number of children in foster care-- from-- 9,069-- Iêve led on that effort, as well as the work weêve done to serve our veterans."1399505180,"Marylanders have a choice; theyêre gonna look at experience, theyêre gonna look at record and theyêre gonna look at judgment. Not only, Chris, the things that you offered up for the Attorney General, but also the fact that he was the only Stateês Attorney in the history of Maryland reprimanded by the highest court for misconduct, ethical misconduct in office because he denied a defendant the right to a fair trial because he, for political gain, spoke out."1399505202,Time.1399505203,"Thatês judgment, voters are gonna be (UNINTEL) that."1399505206,"Attorney General, you can respond to that, as well as the question that Chris originally posed."1399505209,So the-- the reprimand?1399505210,"If youêd like, yes, you could just--"1399505211,"Yeah-- yes, I have the honor of being reprimanded by the Court of Appeals because I took on a judge who said to an 11-year-old girl who was raped by a sexual Internet predator that it takes two to tango and that it was her fault for responding to his emails, which is why he went and raped her. The Court of Appeals then reprimanded me-- for being a public official publicly reading a public charging document at a press conference with the police. I-- I wear it as a badge of honor."1399505236,"As far as character, I think my character stands for itself. Iêve been in public office for 22 years representing-- the-- the victims of crime, I-- Iêve taken on cases, for example, Garret Wilson, who murdered both of his babies in the 1980s and they were ruled as SIDS death."1399505252,"Nobody else would prosecute that case, I did, and heês spending the rest of his life behind bars. There were children in Baltimore City who didnêt have access to the same things the rest of Maryland did to be able to play lacrosse. So six years ago, I started-- I cared about them, so I started a league called (UNINTEL) Youth Lacrosse. We have over 400 boys and girls in that league right now that are all prospering and being able to go to better schools and-- and being active in their communities. Lemme talk about the beach party because--"1399505278,"Well-- well, youêre-- youêre over on your time, but Iêm gonna ask you-- you have (UNINTEL) Iêm gonna ask you about that. Did you miss an opportunity, as the Attorney General of the state to deal as the Attorney General with underage drinking? Did you miss an opportunity as a parent to step into that situation and not put blinders on, but deal with it more responsibly?"1399505299,"So my wife and I have been married for 22 years. We are profoundly proud of our children. That night, I went to tell my child what time he was going to leave-- the next morning. Could we-- could I have done something different there that night? Absolutely."1399505310,"Well, will we say things to our children or do things in the future that we could do differently? Absolutely. As a matter of fact, a few weeks later, I took him to college at-- at Penn, and is there underage drinking at college? Absolutely. Iêm not gonna not send him to college, but we worry. We parent on the fly. And-- and that is-- that was the mistake we made that night. In terms of Attorney General, Iêd-- Iêd rather mention to taking caffeinated alcohol beverages off the shelf."1399505333,"All right. All right, we are gonna leave it there for a moment. We are gonna take a break here. Take a pause for a brief commercial break. Weêll be right back with many more questions for the candidates for Governor of Maryland. And after the debate, join me for a special Google Hangout on NBCWashington.com. Weêll be right back. (MUSIC)"1399505528,"And we are back, live at the Clarice Smith Performing Arts Center at the University of Maryland with three Democratic candidates for Governor of Maryland. Attorney General, Doug Gansler, Delegate Heather Mizeur and Lieutenant Governor, Anthony Brown. Before we move back to the panel, I wanted to stay for a moment, Lieutenant Governor, on-- on this leadership and character question. You heard the Attorney General respond to questions about that beach party. Firstly, is that a character issue for-- for you in this race? And secondly, how did you respond to his-- his comment about your military record?"1399505558,"Well, I think itês a judgment issue, and the set of rules that apply to the public apply to us. If-- if it was one thing, if it were, perhaps, in your own living room with your children, but months earlier, you looked into the camera, you told parents what we know. We are the role models to discourage underage drinking. You did a public service announcement, but then found yourself in the middle of not one, two or three, but literally, hundreds of teenagers underage drinking. And what I would have done as a parent, (MIC NOISE) and I, too, am a parent, my 19-year-old daughterês sitting (LAUGH) right here in the audience."1399505591,Okay.1399505593,I would have stopped the party and made sure that every child got home safely.1399505596,"Well, as much as I appreciate the Lieutenant Governor-- lecturing me on my parenting skills, I would like to talk about the military question that you just asked. To be clear, I did not say one derogatory syllable to any one of our veterans."1399505608,"Like everybody watching at home and everybody here, I have the deepest respect for our-- our veterans and a profound depth of g-- depth of gratitude toward them, but we can do so much more for our veterans in Maryland. In eight years, we havenêt stepped up. We could get them P.T.S.D. counseling; we have the worst Veterans Administration office in the country here in Maryland, and we need to make sure that we donêt tax the-- the retirement income here in Maryland."1399505631,"Quickly, Lieutenant Governor, respond to that, since you were the--"1399505634,"You canêt build a strong Maryland if you keep cutting it down. And right now, we have an honorable veteran community that is well served by the Maryland Department of Veterans Affairs. These are veterans that are serving veterans. Post Traumatic Stress Disorder, the work that weêre doing to connecting them to jobs. Weêre proud of the work that we do and weêre proud of the service that they perform both here in the community and wherein-- in service. Whether youêre a cook, a clerk, a lawyer-- a pilot or anything else in the military, we value your service to our-- to our nation."1399505668,"Delegate, since youêre here, lemme give you 30 seconds on this issue."1399505670,"David, you asked about leadership and character. I donêt think itês about this kind of personal bickering and attacks. Voters are wanting candidates to remain positive and stay focused on the issues. Leadership and character that we need in Annapolis is a governor that will take on the special interests and fight for middle class families. And that is who I am, thatês who Iêve always been and thatês what you can expect me to do as your governor."1399505691,"All right, Jenna, back to you."1399505694,"So we recently heard a recording that was reportedly the owner of the LA Clippers making racist comments. The NBA has since banned him for life, and President Obama responded by saying, quote, –We constantly have to be on guard on racial attitudes that divide us, rather than embracing our div-- diversity as a strength.” Here in Maryland, the owner of the Red Skins has said that the team name celebrates Native American culture, while others have said itês an offensive racial slur. Is it a slur and should it be changed? And Lieutenant Governor, weêll start with you."1399505732,"Sure. First of all, let me say that-- what the NBA-- did-- in response to the comment by the owner of-- the LA Clippers was-- appropriate-- and it sent a strong signal, that those words, that action is unacceptable. I no longer refer to Washingtonês football team by their nickname."1399505750,"I do find it-- offensive and I would hope that-- the owner, Dan Snyder-- would reach the same conclusion-- and to change the name. I know, I believe that the fan base-- is-- wants the same thing. But-- more importantly-- if weêre going to live up to the kind of Maryland that we can all be proud of, then we have to synchronize our words, our actions, okay? And Dan Snyder, if his football team, particularly, is playing in Maryland, he outta-- he outta synchronize his conscience, his actions and do the right thing and change the name."1399505786,Attorney General?1399505789,Thank you. I started the first civil rights division in our stateês history-- in the Attorney Generalês Office. Weêve taken on the minority achievement gap and higher education. Weêre obviously-- Iêm extremely concerned about the lack of funding for our HBCUs here in Maryland.1399505803,"Weêve addressed voting rights issues. Some-- Iêm keenly aware of this issue-- involving civil rights and people that feel discriminated against. You know, in terms of the Red Skins-- Iêve been a life-long Red Skins fan, I do a show every week before the game for the Red Skins, and I am sympathetic to-- those fans that deeply love the name and understand that it wasnêt intended as a slur. But it is."1399505825,"And so, we-- we should move towards changing the name away from the Red Skins because people find it offensive. We change the name of the (UNINTEL) when-- when they-- when people found that offensive, and look at tonight, the Wizards are playing right up against this debate, and hopefully, theyêre winning. And so-- (LAUGHTER) and-- and so, we can change the name and move on, and I think that if-- if people are offended by it, we actually should change the name, and the Red Skinsê-- owners will make a lot more money by selling-- throwback jerseys and the like."1399505850,"If they donêt, though, if-- if you were governor of this state, would you pursue some recourse to put pressure on the team to do it, pressure on the NFL to do it?"1399505858,"No, I think no. I-- I think I would-- I would meet with-- Mr. Snyder and-- and people from the Red Skins organization and try and come to an understanding. I think theyêre going to change the name, I think that the-- dye is-- is cast and I think theyêre gonna change the name. The question is when and how."1399505873,Delegate Mizeur?1399505876,"Words matter, and I am opposed to the name of the Washington Red Skins, and Iêve made that clear over the course of this election. But our actions matter even more. Letês talk about the income inequality that exists in our state. We raised the minimum wage this year, but it was so watered down by the time we pushed it through, that the next governor will be running for reelection before it even gets the tin tin (PH). And we didnêt include provision that indexed it for inflation or addressed the problem of our tipped workers, still only earning $3.63 an hour. Many of those workers are women and people of color."1399505912,"If you look at our gender pay gap in this state, women are still making, on average, $.85 on the dollar to their male counterparts. But if youêre an African-American woman, thatês $.67. If youêre a Latina woman, itês $.46. This is an issue of urgency that demands a governor that cares about these issues and will fight to address the income inequality gap that has plans to provide minimum wage-- relief. I-- I wanna not just have a minimum wage--"1399505939,Time.1399505940,I wanna have a living wage. And Iêm the only candidate up here that has put that policy on the table.1399505944,To Chris Lawrence.1399505945,"As a father of two very young children, I wanna ask a question about schools, which itês something thatês very, very important to a lotta Maryland moms and Maryland dads out there. Just down the road from here, Montgomery Countyês enrollment has grown by about 15,000 students just since the year 2000."1399505966,"The county educates more than 17% of Marylandês students, and yet, it only received about 11% of school construction funds. My question is: Will you work to change the current funding mechanism for Maryland (MIC NOISE) schools to steer more money to Montgomery County? And letês start with Delegate Mizeur."1399505987,"Thank you for the question, itês a really critical one. I got involved in this issue three years ago as Vice Chair of Education and Economic Development for our Appropriations Committee. And I was touring schools in Baltimore City. I was in Holabird Academy and I was devastated by what I saw. (NOISE) Fountains that the kids canêt drink out of because theyêre lead piped-- theyêre too cold in their-- rooms with-- coats taking their exams because the heat doesnêt work."1399506013,"Iêve seen prison conditions better than these schools. And I coulda come home to Montgomery County and said, –Thatês Baltimoreês problem.” But I recognized that Baltimoreês problem was the most acute-- $3 billion problem of what is a $15 billion crisis for the entire state."1399506029,"We had to fix it in Baltimore first before we could fix it anywhere else, and I was-- (MIC NOISE) really proud to be involved in getting that first round of funding put together. Itês a model we can use to bring funding to Montgomery County, Baltimore County and Prince Georgeês County, which we fought to get done this legislative session. And as governor, Iêll get it done. I have a plan in my jobs and economic development plan that has two more ideas on how we can get that money. (LAUGHTER) Youêll have to read about it on my website."1399506059,Whoês up next on it?1399506060,"It should be the-- Attorney General, Mr. Brown, (UNINTEL). Lieutenant Governor, excuse me. Yeah."1399506066,"Okay-- time. (LAUGHTER) Look, we-- over the last seven years, we built, according to Education Week Magazine, some of the best schools in the nation. We rank number one. But I think everyone understands and believes that Iêm cert-- certainly committed to ensuring that every child, whether youêre educated in Bethesda, Chevy Chase or in Baltimore City, has access to a world class education in a modern technology-ready classroom. Thatês why over the last eight years, weêve increased investments in school construction at a high water mark of $400 million, an average of $340 million a year. Thatês not enough. I put forward a plan in December, so over the next four years, we will increase that average to $500 million a year."1399506112,"Iêm committed to working with the-- local leadership in Montgomery County to do exactly what we did in Baltimore County. We authorized a $1.1 billion school construction program to get those children out of the second oldest set of schools in the state. We can do that; we have the resources in Maryland. Itês not gonna be easy. We have to set our priorities. In a Brown-Ulman Administration, schools are a top priority."1399506137,So the Attorney General.1399506138,"I grew up in Montgomery County, I-- Iêm a proud graduate of the Chevy Chase Elementary School. My-- my family lives in Montgomery County, so I actually know what Montgomery County is like, and itês not like-- much of what the state believes it to be like. Weêre a majority/minority-- county; we have 166 languages spoken in our schools. And to your question, we are-- woefully underfunded. Baltimore City needed new schools, and they got-- they got a billion dollars towards that."1399506163,"But Montgomery County, Prince Georgeês County and Baltimore County deserved to have new schools, too. But not only that, the Lieutenant Governorês been in office for eight years, at the s-- at the seat of power, and stood by while Maryland has the number two-- number two minority achievement in the country, the second-worst."1399506181,"And thatês the moral state of our state. So we need to address that. I was the first candidate to come out for expanding pre-k for all people in Maryland, particularly, starting with people 300% above the poverty line or below. We want-- but we also have to make sure we have skilled teachers, like in any other profession, reward the-- the people who are more astute (PH), which is our teachers."1399506201,"Time. Lieutenant Governor, take 30 seconds for a rebuttal."1399506202,"Thank you 30 seconds. Maryland leads the nation when it comes to reducing the achievement gap by income and we have work to do. Our students of color are making the greatest progress in 4th grade and 8th grade math and reading; we still have an achievement gap to close, thatês why I have a plan."1399506216,"Doug, you talk about a moral stain in education achievement gap, if we pass the Gansler Corporate Tax Giveaway, that moral stain will become an indelible blemish, as generations of students will not have access to early childhood education, which is proven to be one of the best ways to eliminate the achievement gap in--"1399506234,"Attorney General, take 30 seconds to--"1399506236,"President Obama-- Congressman Van-- Van Hollen, Congressman Hoyer all are for reducing the corporate tax. The prob-- the-- one of the reasons why weêre losing so many of our companies to Virginia is because we have an eight and a quarter-- corporate tax (UNINTEL) at 6%."1399506249,"I was an Economics major Yale, I get that people operate on the best interests. If we-- reduce the corporate tax by a quarter of a point each year, more jobs will come, our tax base will be en-- enhanced, and weêll be able to do things like fix the schools, where-- where we have this minority achievement gap. So I-- you know, we do need-- and I agree with Heather Mizeur, we need to close that corporate loophole for the big companies."1399506271,Let me go back to Chris.1399506272,"Call this the legacy question. The current governor, Martin OêMalley, had a very progressive list of priorities and passed most of them, if not all of them. The Green Act, lowering-- and making in-state tuition for the children of illegal immigrants. Same-sex marriage, abolishing the death penalty, tough gun control laws."1399506293,"And this session, is top priority, raising the minimum wage. So my question to each of you is, whatês the next big idea that you have? What would be your legacy, if elected governor of Maryland? And we start with-- Delegate Mizeur."1399506307,"Actually, weêre gonna start with the Attorney General. Weêre-- weêre watching this closely. So the Attorney General will speak next."1399506311,"Thanks for noticing. I was five years ahead of most people on the issue of marriage equality; I went down and testified on it before anybody else-- thought it was a good idea. They literally tried to impeach me in Annapolis, and-- of course, my wife was hoping they would be successful so I could get a real job, here I am again-- Attorney General running for yet a new job."1399506330,I then wrote an opinion recognizing out-of-state same-sex marriages here in Maryland because I thought it was the right thing to do and I didnêt think people should be discriminated against. I then was the first person on the stage to come out for increasing the minimum wage. Itês just not fair.1399506345,"If youêre making $7.25 an hour working 40 hours a week and youêre still under the federal poverty line, thatês just not right. So we need to-- I think the next thing we need to do is bring jobs back to Maryland. We cannot sustain this. Thereês too many poor people. When you have 46% of the people in-- Baltimore-- going-- men out of work, thatês wrong. And the second is dealing with re-entry. Taking prisoners-- from behind bars and making them tax-paying citizens."1399506370,Delegate Mizeur?1399506373,"Thank you. I have a plan to make sure that we donêt just have a minimum wage in this stage, we have-- a living wage, •cause no one should be working 40 hours a week and still be living in poverty. I have a plan to make sure that we address (NOISE) that achievement gap that we discussed earlier."1399506391,"It still matters in Maryland what your socio-economic status is and what your race is to determine whether or not youêre gonna be successful in school. And we know it doesnêt have to be that way. When we invest in early childhood initiatives from birth to age five, we eliminate that disparity and give every child a chance to enter school ready to learn at the same pace."1399506409,"My plan to address this is comprehensive. Itês a universal pre-k plan, not just for four-year-olds, not just for four-year-olds from some low-income families, all of our four-year-olds, and weêll cover a half day for three-year-olds, as well."